ID,Title,Abstract,Authors,Author_Year,Year,Journal,DOI,Research Location,Construction Application Area,Construction Topic,Research Method,Methodology,Research Goal,Gaps Addressed,Future Research,Results,AI Model Used,Data Types
110,Enhanced identification of equipment failures from descriptive accident reports using language generative model,"Purpose: Equipment failure is a critical factor in construction accidents, often leading to severe consequences. Therefore, this study addresses two significant gaps in construction safety research: (1) effectively using historical data to investigate equipment failure and (2) understanding the classification of equipment failure according to Occupational Safety and Health Administration (OSHA) standards. Design/methodology/approach: Our research utilized a multi-stage methodology. We curated data from the OSHA database, distinguishing accidents involving equipment failures. Then we developed a framework using generative artificial intelligence (AI) and large language models (LLMs) to minimize manual processing. This framework employed a two-step prompting strategy: (1) classifying narratives that describe equipment failures and (2) analyzing these cases to extract specific failure details (e.g. names, types, categories). To ensure accuracy, we conducted a manual analysis of a subset of reports to establish ground truth and tested two different LLMs within our approach, comparing their performance against this ground truth. Findings: The tested LLMs demonstrated 95% accuracy in determining if narratives describe equipment failures and 73% accuracy in extracting equipment names, enabling automated categorical identifications. These findings highlight LLMs' promising identification accuracy compared to manual methods. Research limitations/implications: The research's focus on equipment data not only validates the research framework but also highlights its potential for broader application across various accident categories beyond construction, extending into any domain with accessible accident narratives. Given that such data are essential for regulatory bodies like OSHA, the framework's adoption could significantly enhance safety analysis and reporting, contributing to more robust safety protocols industry-wide. Practical implications: Using the developed approach, the research enables us to use accident narratives, a reliable source of accident data, in accident analysis. It provides deeper insights than traditional data types, enabling a more detailed understanding of accidents at an unprecedented level. This enhanced understanding can significantly inform and improve worker safety training, education and safety policies, with the potential for broader applications across various safety-critical domains. Originality/value: This research presents a novel approach to analyzing construction accident reports using AI and LLMs, significantly reducing manual processing time while maintaining high accuracy. By identifying equipment failures more efficiently, our work lays the groundwork for developing targeted safety protocols, contributing to overall safety improvements in construction practices and advancing data-driven analysis processes.","Ray, U.; Arteaga, C.; Ahn, Y.; Park, J.",Ray et al. (2024),2024,"Engineering, Construction and Architectural Management",https://doi.org/10.1108/ECAM-09-2024-1259,United States,"Construction safety, specifically equipment failure identification and accident analysis",Construction safety,Mixed method,"The research utilized a multi-stage methodology involving: (1) data collection of 800 OSHA construction accident reports (300 with equipment failures, 500 without), (2) development of a two-stage prompting framework using LLMs - first stage classifies narratives as describing equipment failures or not, second stage extracts specific equipment details, (3) manual validation by three researchers to establish ground truth, (4) testing two LLMs (ChatGPT-3.5 and InstructGPT) with various prompt formulations and parameters, and (5) categorization of equipment failures according to OSHA standards (29 CFR Part 1926).","The study aims to develop an automated framework using Large Language Models to identify and categorize equipment failures from unstructured OSHA accident narratives, significantly reducing manual processing time while maintaining high accuracy and aligning findings with OSHA standards.","The paper addresses two significant gaps: (1) effectively using historical accident narrative data to investigate equipment failure when manual analysis is time-consuming and error-prone, and (2) understanding the classification of equipment failure according to OSHA standards, which previous studies have not systematically aligned with regulatory frameworks.","Future work should focus on integrating this framework into real-time safety monitoring systems for dynamic hazard detection, expanding the dataset to include accident narratives from diverse industries (manufacturing, mining), and incorporating clustering algorithms with semantic similarity models to automate the categorization of similar equipment failures and refine accuracy.",The LLMs demonstrated 95.13% accuracy in classifying whether narratives describe equipment failures and 73% accuracy (substring match) in extracting equipment names. The analysis revealed that heavy and mechanized equipment (22.1%) and scaffolds (15.2%) were the most frequent categories of equipment failures in construction accidents.,ChatGPT-3.5 and InstructGPT (Large Language Models from OpenAI),"Unstructured textual data consisting of 800 construction accident narrative reports from the OSHA database spanning 2011 to 2023, including descriptive accident reports with information about equipment failures, accident precursors, worker actions, and accident causes."
111,Personalized construction safety training system using conversational AI in virtual reality,"Training workers in safety protocols is crucial for mitigating job site hazards, yet traditional methods often fall short. This paper explores integrating virtual reality (VR) and large language models (LLMs) into iSafeTrainer, an AI-powered safety training system. The system allows trainees to engage with trade-specific content tailored to their expertise level in a third-person perspective in a non-immersive desktop virtual environment, eliminating the need for head-mounted displays. An experimental study evaluated the system through qualitative, survey-based assessments, focusing on user satisfaction, experience, engagement, guidance, and confidence. Results showed high satisfaction rates (>85 %) among novice users, with improved safety knowledge. Expert users suggested advanced scenarios, highlighting the system's potential for expansion. The modular architecture supports customization across various construction settings, ensuring adaptability for future improvements.","Sabir, A.; Hussain, R.; Pedro, A.; Park, C.",Sabir et al. (2025),2025,Automation in Construction,https://doi.org/10.1016/j.autcon.2025.106207,Republic of Korea,Construction safety training,Construction safety,Mixed method,"The paper develops iSafeTrainer, an LLM-integrated VR safety training system that uses conversational AI (ChatGPT, Whisper for voice transcription) within a non-immersive desktop VR environment. The system employs prompt engineering to personalize training based on users' trade (electrical, scaffolding, welding) and knowledge level (novice, beginner, expert). Evaluation was conducted through questionnaire-based surveys (structured and unstructured questions) with 31 participants to assess user satisfaction, engagement, safety knowledge improvement, and system usability.","The goal is to develop and evaluate an AI-powered VR safety training system that provides personalized, trade-specific, and adaptive construction safety training to address the limitations of traditional one-size-fits-all training methods.","The paper addresses the limitations of traditional static, pre-scripted VR training scenarios that lack adaptability to different trade specializations and fail to provide immediate, personalized feedback tailored to users' expertise levels and individual learning needs.","Future research will incorporate comparative and statistical analyses with quantitative metrics like task completion rates, hazard recognition scores, and learning retention. The system will be enhanced to develop LLM-integrated virtual instructors capable of demonstrating safety tasks and autonomously recommending video-based training content from web databases, with potential for multilingual support and trade-specific AI-driven scenario generation.","The system demonstrated high satisfaction rates (>85%) among novice users with improved safety knowledge. Overall, 81% of participants were satisfied, 85% found voice interaction easy, and 85% reported improved understanding of safety hazards and mitigation strategies. However, expert users (15-16% satisfaction) suggested more advanced scenarios, indicating the need for system refinement for experienced users.","ChatGPT (GPT-4), Whisper (OpenAI speech recognition and translation), Text-to-Speech (TTS)","Survey data from questionnaires (structured Likert-scale responses and unstructured open-ended feedback) collected from 31 participants including undergraduate and graduate students and post-doctoral candidates. The system also uses 3D mesh data from Gaussian Splatting and Sketchfab, along with virtual construction site objects and hazard simulations."
112,Internet of Things in construction: trends and adoption insights from a scientometric perspective,"The adoption of the Internet of Things (IoT) in the construction industry has garnered significant academic interest, with a notable increase in research over the past decade. This study conducts a scientometric review of 428 papers published between 2010 and 2024, aiming to identify key trends, highlight emerging themes, and offer directions for future research to avoid redundancy. Through bibliographic coupling and scientific network analysis, the review uncovers prominent co-occurring keywords and themes, such as the integration of IoT with artificial intelligence, blockchain, cloud and edge computing, Building Information Modelling (BIM), and Digital Twins. A major finding is that improving safety, particularly in worker health and underground construction, is the most frequently addressed objective. Other focal areas include post-occupancy analysis, site management, infrastructure development, life cycle management, and prefabrication. However, the research highlights significant gaps. While IoT and BIM integration are well-explored, their application to worker safety and underground construction remains limited. The combination of Digital Twins and IoT is also underutilized in design evaluation, prefabrication, and life cycle management. This review underscores the complementary roles of various technologies and calls for interdisciplinary collaboration to fully realize the potential of IoT in advancing safety and efficiency in the construction industry.","Sadeghi, J.; Ahmadi, A.; Phipps, R.",Sadeghi et al. (2025),2025,International Journal of Construction Management,https://doi.org/10.1080/15623599.2025.2508905,"New Zealand (Massey University, Auckland; Victoria University of Wellington, Wellington)","IoT integration with AI for safety management, worker health monitoring, site management, post-occupancy analysis, infrastructure development, life cycle management, prefabrication, Building Information Modeling (BIM), digital twins, underground construction safety, and structural analysis","Construction technologies (BIM, drones, laser scanning, robotics, digital twins, sensor networks)",Quantitative,"The paper conducts a scientometric analysis of 428 documents published between 2011 and 2024 using bibliometric methods. Data were collected from Scopus and Google Scholar, then analyzed using VOSviewer 1.6.18 for network visualization including keyword co-occurrence and bibliographic coupling. A Python-based text mining tool was developed to process cluster data and identify dominant themes. The analysis includes publication trends, author co-authorship networks, country collaboration networks, keyword density visualization, and citation burst analysis.","The paper aims to provide insights into key focus areas of IoT research in construction, recognize the complementary roles of technologies such as AI, BIM, blockchain, digital twins, and cloud/edge computing, highlight the main goals of IoT adoption in construction, and identify research gaps to guide future research and avoid redundancy in the field.","The paper identifies significant research gaps including: (1) limited exploration of IoT-BIM integration for worker safety and underground construction despite their potential, (2) underutilization of digital twin and IoT integration in design evaluation, prefabrication, and life cycle management, (3) the overlooked area of IoT application in prefabrication when examining safety promotion, and (4) the absence of research on IoT integration with Lean construction methods despite potential benefits in reducing waste and improving efficiency.","Future research directions include investigating IoT-BIM integration for enhanced safety management through real-time monitoring and predictive analytics, exploring IoT optimization of safety protocols in prefabrication processes, assessing the role of IoT and digital twins in life cycle management from design through prefabrication, evaluating the synergy between IoT and lean construction principles, and analyzing how digital twin and IoT integration enhances construction logistics tracking and building condition monitoring.","The analysis revealed that 'Building Information Modelling (BIM)' and 'artificial intelligence/machine learning' are the most frequently occurring keywords, with safety (particularly worker safety and underground construction) being the most frequently addressed objective. China, India, and the USA collectively account for 50% of the publications, with the year 2023 having the highest number of articles. The review identifies BIM as the primary complementary technology with IoT, while also highlighting the roles of digital twins, AI, blockchain, and edge/cloud computing in enhancing IoT applications in construction.","No Model (This is a review paper that analyzes existing literature rather than implementing specific AI models, though it discusses AI and machine learning integration with IoT in the reviewed studies)","Bibliometric data from 428 articles published between 2011 and 2024, collected from Scopus and Google Scholar databases. The data includes journal articles, conference papers, book chapters, titles, abstracts, keywords, author information, citations, publication years, and countries of origin. The analysis focused on metadata such as co-authorship patterns, keyword frequencies, citation bursts, and bibliographic coupling relationships."
113,AI model for analyzing construction litigation precedents to support decision-making,"Litigation among stakeholders in construction projects has a significantly negative impact on successful project completion and overall performance. Prompt decision-making in relation to litigation is crucial, but the manual review of extensive document sets is time-consuming. In this paper, the natural language processing (NLP) technique was applied to litigation data to develop a model for case summarization and winner prediction. By automatically summarizing the data and predicting litigation outcomes, the proposed model aids practitioners in making timely decisions and enhances document management during disputes. This paper contributes to existing knowledge in two ways. Firstly, the model aids practitioners in making timely decisions about proceeding with litigation. Secondly, unlike previous studies that manually processed raw data such as contracts and specifications, this study utilized NLP to process raw litigation case data automatically. As big data becomes increasingly common, the methodology employed in this study holds academic significance.","Seo, W.; Kang, Y.",Seo and Kang (2024),2024,Automation in Construction,https://doi.org/10.1016/j.autcon.2024.105824,"South Korea, South Korea","Construction litigation and dispute management, claims and dispute resolution, contract compliance",Risk management,Quantitative,"The paper applies Natural Language Processing (NLP) techniques to construction litigation precedent data. It uses BERT and RoBERTa models for auto-summarization (using TextRank, LexRank, and BERT extractive summarization) and classification prediction to determine winning stakeholders (owner vs. contractor). The dataset consists of 300 federal court cases from the Westlaw database (2004-2023), split 7:3 for training and testing.",The paper aims to develop an AI-based model that automatically summarizes construction dispute litigation cases and predicts litigation outcomes to support timely decision-making by practitioners during dispute management.,"Previous construction dispute prediction studies manually labeled feature attributes from raw data, which is time-consuming and omits contextual information. Existing NLP models from general legal fields do not consider the unique characteristics of construction contracts and stakeholder relationships.","Future research should increase sample size to improve accuracy, incorporate arbitration data in addition to litigation cases, diversify output labels to include multiple stakeholders (subcontractors, engineers, suppliers), integrate various data types (numerical, drawings, photos), and develop systematic validation methods for auto-summarization quality.",The RoBERTa model achieved the highest classification accuracy of 66% (F1 score of 0.655) for predicting litigation outcomes. BERT-based extractive summarization was found most appropriate for condensing lengthy legal texts. The contractor category showed higher F1 score (0.696) than the owner category (0.614).,"BERT (Bidirectional Encoder Representations from Transformers), RoBERTa (A Robustly Optimized BERT Pretraining Approach), TextRank, LexRank, Word2vec, SVM, Random Forest, K-Nearest Neighbor, XGBoost","The paper uses litigation case text data from the Westlaw database, specifically 300 federal court construction dispute cases from 2004-2023. The data includes synopsis, factual background, and procedural history sections, with court decisions labeled by winning stakeholder (owner or contractor)."
114,Leveraging data-driven machine learning techniques to enhance bearing capacity estimation in prebored and precast piles,"The rapid pace of urbanization and the increasing demand for reliable deep foundation systems in metropolitan areas necessitate advanced methodologies for accurately predicting the bearing capacity of pile foundations. This study presents a novel application of machine learning (ML) techniques to estimate the pile bearing capacity (PBC) of prebored and precast piles (PPP) constructed with pretensioned prestressed high-strength concrete (PHC). Unlike traditional approaches that rely on empirical dynamic driving formulas, this research explores the potential of ML models to provide more accurate and practical solutions for construction quality control. Three ML algorithms—K-Nearest Neighbor Regression (KNR), Extreme Gradient Boosting (XGB), and Deep Neural Networks (DNN)—were employed to predict PBC at two critical stages of PPP installation: the End of Initial Driving (EOID) and Restrike phases. A dataset comprising 217 dynamic load tests was used for model development and validation. The results demonstrate that the ML models, particularly the DNN, significantly outperform traditional dynamic driving formulas such as the Hiley, Danish, and Gates methods in terms of both prediction accuracy and generalization capability. The DNN model achieved R2 values of 0.960 for EOID and 0.915 for Restrike phase predictions, with minimal prediction errors across varying site conditions. Importantly, this study introduces a direct comparison between AI-driven models and conventional formulas, providing empirical evidence that ML-based predictions are less susceptible to the overestimations and underestimations often observed in traditional methods. Furthermore, interpretability was enhanced through SHapley Additive exPlanations (SHAP), which identified key influencing factors, such as pile diameter and ram weight, offering valuable insights for on-site decision-making and adaptive control during pile driving operations. By validating ML predictions against field-tested PDA results and widely used empirical formulas, this research establishes the practical feasibility of integrating AI into existing construction workflows. The proposed ML approach not only enhances prediction reliability but also streamlines quality control processes, reducing dependence on empirical judgments and contributing to more efficient and cost-effective project delivery.","Seo, S.; Kim, G.; Park, J.-B.; Kim, J.; Park, Y.-B.; Chung, M.",Seo et al. (2025),2025,Expert Systems with Applications,https://doi.org/10.1016/j.eswa.2025.128070,Republic of Korea,"Pile foundation bearing capacity estimation, construction quality control",Structural engineering,Quantitative,"The paper employs three machine learning algorithms (K-Nearest Neighbor Regression, Extreme Gradient Boosting, and Deep Neural Networks) to predict pile bearing capacity of prebored and precast piles at two critical installation stages (EOID and Restrike). A dataset of 217 dynamic load tests was used for model development and validation, with 10-fold cross-validation applied to evaluate generalization performance, and SHAP analysis used for model interpretability.","The study aims to develop and validate machine learning models for predicting the pile bearing capacity of prebored and precast piles (PPP) at both End of Initial Driving (EOID) and Restrike phases, providing a more accurate alternative to traditional empirical dynamic driving formulas for construction quality control.","The paper addresses the limitations of traditional dynamic driving formulas that oversimplify complex pile-soil interactions and are insufficient for PPP, particularly in differentiating between EOID and Restrike phases. Existing ML research has primarily focused on driven piles and drilled shafts, leaving a significant gap in understanding and predicting PPP behavior across its unique two-stage construction process.","Future research will focus on integrating additional geotechnical parameters such as soil classification, SPT-N values, and time-dependent properties to improve prediction accuracy and model generalization. The study also suggests further refinement of models through additional training to enhance predictive accuracy in Restrike conditions.","The DNN model achieved the highest prediction accuracy with R² values of 0.960 for EOID and 0.915 for Restrike phase predictions, significantly outperforming traditional dynamic driving formulas (Hiley, Danish, Gates) and showing minimal prediction errors across varying site conditions. All ML models demonstrated superior performance compared to traditional formulas, with predictions requiring no dynamic reduction factor (DRF) adjustments and maintaining consistent accuracy across different energy transfer ratios (ETR) and set values.","K-Nearest Neighbor Regression (KNR), Extreme Gradient Boosting (XGB), Deep Neural Networks (DNN)","The study uses a dataset of 217 dynamic load tests from prebored and precast piles (PPP) constructed with pretensioned prestressed high-strength concrete (PHC). Input variables include pile diameter, pile length, drop height, ram weight, set values, and elapsed time, with pile bearing capacity as the output variable measured through CAPWAP analysis from field PDA tests."
