ID,Title,Abstract,Authors,Author_Year,Year,Journal,DOI,Research Location,Construction Application Area,Construction Topic,Research Method,Methodology,Research Goal,Gaps Addressed,Future Research,Results,AI Model Used,Data Types
39,Automating data integration for construction Life Cycle Assessment Using fuzzy matching and supervised learning,"Automating data-driven processes in construction is critical for enhancing efficiency and reducing human intervention. Life Cycle Assessment (LCA) in construction relies on the seamless integration of construction and environmental databases; however, manual processes are time-consuming and error-prone. This paper presents a methodology that fully automates data integration using fuzzy string matching and Random Forest (RF)-based supervised learning. The approach ensures accuracy and efficiency while eliminating manual effort. When applied to the Andalusia Construction Cost Database (BCCA) and ecoinvent databases, the methodology achieved high accuracy and reduced manual intervention time by 90%. This scalable solution advances automation in construction by facilitating real-time decision-making, improving digital workflows, and supporting sustainable construction practices through AI-driven data management.","Gachkar, D.; Gachkar, S.; Ghofrani, E.; Garcia-Martinez, A.; Angulo Bahón, C.",Gachkar et al. (2025),2025,Automation in Construction,https://doi.org/10.1016/j.autcon.2025.106381,"Spain, United Kingdom","Life Cycle Assessment (LCA), environmental impact assessment, construction database integration, sustainable construction practices, material classification",Sustainable construction,Mixed method (quantitative and qualitative),"The paper proposes a four-step methodology combining fuzzy string matching and Random Forest supervised learning to automate the integration of construction and environmental databases. First, both databases are cleaned and standardized. Second, a mapping dictionary categorizes construction materials. Third, fuzzy matching identifies textually similar entries, followed by Random Forest classification to detect semantic matches beyond text similarity. Finally, unit conversions are performed using density values to align measurement units.","The goal is to fully automate the integration of construction and environmental databases for Life Cycle Assessment applications, enhancing efficiency and accuracy while eliminating manual effort and reducing time required for database correlation by 80-90%.","The paper addresses the labor-intensive, inconsistent, and error-prone nature of manual database integration for LCA in construction. It tackles challenges including data interoperability, lack of standardization, inconsistent naming conventions, and unit incompatibility between construction and environmental databases.","Future research should explore expanding the methodology to composite materials and operational impacts, testing adaptability across diverse regional datasets and languages, refining unit conversion algorithms with uncertainty quantification, developing standalone software tools for practitioners, and integrating advanced AI methods such as domain-specific language models and transformer architectures.","The methodology achieved 90% accuracy when applied to the Andalusia Construction Cost Database (BCCA) and ecoinvent databases, reducing manual intervention time by 80-90%. The Random Forest classifier reached 95% accuracy after iterative training with 2,500 labeled matches, demonstrating scalability and effectiveness in automating material matching despite textual and unit discrepancies.","Random Forest (RF) classifier, fuzzy string matching algorithms (fuzzywuzzy package)","The paper uses structured construction database data (Andalusia Construction Cost Database - BCCA) containing material codes, titles in Spanish/English, and units, as well as environmental database data (ecoinvent) with life cycle inventory information including material names, codes, units, and environmental impact factors for construction materials."
40,ADVANCES IN HUMAN-ROBOT COLLABORATION (HRC) IN CONSTRUCTION 5.0 FOR BUILDING CONSTRUCTION: A BIBLIOMETRIC AND SYSTEMATIC LITERATURE REVIEW,"Construction, characterized by its inherent risks, demands innovative solutions to ensure the safety and efficiency of processes. Human-robot collaboration (HRC) emerges as a promising alternative in this context, especially within the framework of Construction 5.0. However, existing research presents gaps in the comprehensive understanding of the advances and future potential of this synergy. This study addresses this gap through a systematic review of 181 articles published between 2013 and 2024, using a methodology that combines quantitative and qualitative analysis. The results, obtained through an exhaustive literature search and data visualization tools, reveal emerging trends in HRC research within the building sector. In addition, it delves into three key areas of progress: the development of AI-assisted classification systems to improve efficiency in specific tasks, the exploration of robots with emotional capabilities for more flexible adaptation to work environments, and virtual reality training to optimize human-robot collaboration. In addition, three future lines of research are proposed to further explore HRC in the building sector. This research significantly expands the existing knowledge on this topic, placing it at the forefront of the discipline. It also provides practical guidelines for construction professionals to adopt the principles of Construction 5.0, enabling them to address the complex challenges of construction more effectively.","Garcés, G.",Garcés (2025),2025,Journal of Information Technology in Construction,https://doi.org/10.36680/j.itcon.2025.050,"Spain, Chile","Human-robot collaboration (HRC) in building construction, including automation of construction tasks, material sorting, waste management, robotic assembly, inspection, demolition, and construction safety","Construction technologies (BIM, drones, laser scanning, robotics, digital twins, sensor networks)",Mixed method,"This study employs a three-stage methodology combining bibliometric analysis with systematic literature review. Stage 1 involves a systematic review using PRISMA methodology to identify interactions in HRC. Stage 2 conducts bibliometric analysis and social network analysis using VOSviewer to assess publication trends, co-citation patterns, and keyword co-occurrence from 181 articles (2013-2024) retrieved from Web of Science. Stage 3 performs qualitative analysis of the discussions to identify key conceptual connections and technological trends in Construction 5.0.","The goal is to provide a comprehensive overview of advances in human-robot collaboration (HRC) in building construction within the Construction 5.0 framework, identify current research trends, cutting-edge practices, and propose future research directions to address existing knowledge gaps.","The paper addresses the lack of comprehensive studies exploring the integration of HRC in building construction under Construction 5.0 principles. Specifically, it fills gaps regarding current trends, best practices, effectiveness of HRC protocols, and the challenges and opportunities of implementing HRC in the building sector.",Future research should focus on three main directions: (1) ethical considerations and mitigation of algorithmic biases in HRC; (2) development of standards and regulations for HRC implementation in construction; and (3) exploring neurofeedback-enhanced HRC to optimize robot performance and human-robot collaboration in building construction environments.,"The bibliometric analysis reveals exponential growth in HRC research since 2020, with the United States, China, and Germany leading publications. Three key cutting-edge practices were identified: immersive virtual reality training for HRC, AI-powered classification systems for collaborative construction, and adaptive socio-emotional systems for collaborative robots. The study also identified key research trends including construction robotics, automation, system development, and safety as the most prominent themes.","Deep learning, machine learning, artificial neural networks, convolutional neural networks (CNNs), reinforcement learning, hybrid AI systems combining symbolic reasoning with deep learning, spiking neural networks, and brain-computer interfaces (neurofeedback systems using EEG)","Bibliometric data from 181 academic articles retrieved from Web of Science database (2013-2024), including publication metadata, citation networks, keyword co-occurrence data, author collaboration patterns, and institutional affiliations. Qualitative data extracted from systematic review of literature discussing HRC applications, technologies, and methodologies in construction."
41,Optimizing Modularization of Residential Housing Designs for Rapid Postdisaster Mass Production of Housing,"Postdisaster housing reconstruction (PDHR) is a highly complex process because of the large number of recovery projects for affected communities and the shortage of resources after a disastrous event. PDHR also needs a strategy that reconsiders it as a large-scale integrated portfolio of projects instead of individual building reconstruction projects. However, this complexity and the lack of a holistic, systematic approach for planning frequently lead to an ad-hoc or case-by-case decision-making process. To resolve this critical challenge in postdisaster housing mass production, this study investigates and develops a systematic approach that optimizes the design modularization of housing recovery projects considering manufacturing, transportation, and assembly factors for a cost-efficient and sustainable implication of modular construction (MC) in PDHR. Using the genetic algorithm-based optimization method, the proposed method addresses the possible trade-offs between the commonality and suitability of the module configurations for PDHR projects. In addition, the authors used a set of feasible configurations of a variety of modular housing designs created from the AI-based generative design system and conducted the mass production scenarios after a disaster to validate the accuracy and robustness of the proposed methodology. The results clearly show that the proposed method significantly improved optimization and decision-making of MC design and construction processes and considerably enhanced rapid and logical responses to the demands of the postdisaster recovery process. The newly developed method is expected to assist the planners in formalizing the commonality concept in the PDHR process and achieving an optimal level of modularity and commonality that meet the required variation while maintaining the advantages of mass production.","Ghannad, P.; Lee, Y.-C.",Ghannad and Lee (2023),2023,Journal of Construction Engineering and Management,https://doi.org/10.1061/(ASCE)CO.1943-7862.0002390,United States,"Post-disaster housing reconstruction, modular construction design optimization, design modularization, manufacturing, transportation, and assembly planning",Prefabrication / modularization,Quantitative,"The paper develops a systematic optimization approach using genetic algorithm-based optimization (NSGA-II) to optimize modular housing designs for post-disaster housing reconstruction. It incorporates a module configurator that generates feasible modular configurations, modularity assessment (MSI index) for evaluating individual project suitability, commonality assessment (TCCI index) for portfolio-level optimization, and platform modules concept to balance standardization and customization needs.","To develop a systematic approach that optimizes the design modularization of housing recovery projects considering manufacturing, transportation, and assembly factors for cost-efficient and sustainable implementation of modular construction in post-disaster housing reconstruction, addressing both project-level and portfolio-level optimization needs.","The paper addresses two main gaps: (1) existing literature on mass customization in MC neglects the effects of product modularization on downstream processes such as logistics and assembly, and (2) existing modular design optimization studies primarily focus on single projects rather than multiproject portfolios like post-disaster housing reconstruction, lacking systematic frameworks for addressing both commonality and individual project requirements.","The paper suggests expanding the scope to include structural design aspects beyond architectural design, as the current work is limited to the early design phase. Additionally, incorporating more detailed factors from the detailed design phase and considering different platform module types with varying contributions to commonality would enhance the comprehensiveness of the optimization framework.","The proposed method successfully produced Pareto optimal solutions that balance modular suitability (MSI) and commonality (TCCI). Results showed that 3-4 modules per configuration are often optimal, that platform modules with appropriate tolerance significantly increase commonality, and that the number of platform modules and tolerance levels have significant effects on achievable commonality levels in large-scale portfolios.",Genetic Algorithm (NSGA-II - Non-dominated Sorting Genetic Algorithm II),"The paper uses hypothetical housing project data including floor plans with varying numbers of bedrooms, bathrooms, and footage areas. It also uses modular configuration data generated by a rule-based module configurator, connection libraries, transportation constraints, and platform module specifications with parametric definitions and tolerances."
42,Enhanced understanding of bond strength of fiber-reinforcement-polymer bars reinforced concrete subjected to elevated temperature for interfacial failure prevention: Explainable artificial intelligence method,"Fiber-reinforcement-polymer (FRP) bars, as alternatives to traditional steel bars, effectively enhance the durability of concrete structures in extreme environments. However, the interfacial mechanical performance of FRP bars reinforced concrete degrades under elevated temperatures or fire, leading to bonded interface failure. The bond strength between FRP bars and concrete is critical to structural performance, but existing studies lack accurate prediction of its evolution under multi-factor coupling and clear mechanistic explanations. In order to accurately characterize the interfacial bond performance of FRP-reinforced concrete under elevated temperatures, three machine learning models, namely Support Vector Machine (SVM), Random Forest (RF) and eXterme Gradient Boosting (XGBoost), are established to predict bond strength using a database of 289 experimental results. These models are selected for their fitting capabilities matching the data's complexity (nonlinear coupling of multiple features): SVM handles moderate nonlinearity, RF adapts to mid-to-high complexity with anti-overfitting, and XGBoost captures intricate interactions for high complexity. Comparing them identifies the best-fitted model for bond strength prediction. In the established models based on the machine learning algorithms, the significant features are selected such as experimental temperature (T), diameter of FRP bar (d), anchorage length (l<inf>a</inf>), concrete compressive strength (f<inf>c</inf>), and concrete cover thickness to diameter of FRP bar ratio (c/d) considering the credibility of black-box models and the rationality of input features. In addition, the SHapley Additive exPlanations (SHAP) method is employed to enhance interpretability and overcome the ""black box"" problem of the machine learning (ML) based prediction models. Beyond explaining model behavior, its application here provides actionable insights for fire-resistant design: it quantifies feature contributions and interactive effects, addressing the lack of mechanistic guidance in previous artificial intelligence (AI) based studies. This paper provides meaningful guidelines for the interfacial failure prevention and safe service of FRP bars reinforced concrete structures in the elevated temperature environment.","Hao, J.; Zhu, S.; J.; Yao, J.; Zhang, X.; Li, X.",Hao et al. (2025),2025,Engineering Applications of Artificial Intelligence,https://doi.org/10.1016/j.engappai.2025.112677,China,Structural engineering - bond strength prediction of fiber-reinforcement-polymer (FRP) bars reinforced concrete under elevated temperatures for interfacial failure prevention,Structural engineering,Quantitative,"The paper employs three machine learning models (SVM, Random Forest, and XGBoost) trained on a database of 289 experimental pull-out test records. Five input features are selected: experimental temperature, FRP bar diameter, anchorage length, concrete compressive strength, and concrete cover thickness to diameter ratio. The models predict bond strength, and the SHapley Additive exPlanations (SHAP) method is employed to enhance interpretability by quantifying feature contributions and interactive effects.",To accurately characterize the interfacial bond performance of FRP-reinforced concrete under elevated temperatures through machine learning models and provide mechanistic insights for fire-resistant design by overcoming the 'black box' problem of AI models.,"Existing studies lack accurate prediction of bond strength evolution under multi-factor coupling and clear mechanistic explanations. Previous AI models have limited interpretability, small datasets lacking samples for extreme conditions, and a mismatch between model complexity and data characteristics.","Future work should focus on systematic hyperparameter tuning to maximize model accuracy for practical engineering applications. Additionally, expanding samples of high-temperature (>500°C) pull-out tests is needed to enhance model generalization to extreme thermal conditions.","The XGBoost model achieved the best performance with R² of 0.968 (training) and 0.905 (testing). SHAP analysis revealed that temperature exerts dominant influence on bond strength (five times that of FRP bar diameter), 300°C is a critical threshold for accelerated degradation, and smaller FRP bars (6-10 mm) mitigated high-temperature bond loss by 18-25%.","Support Vector Machine (SVM), Random Forest (RF), eXtreme Gradient Boosting (XGBoost)","The dataset comprises 289 experimental pull-out test records compiled from literature review, covering temperatures from 20 to 600°C, FRP bar diameters from 6 to 16 mm, anchorage lengths from 20 to 160 mm, concrete compressive strengths from 21.83 to 68.23 MPa, and c/d ratios from 3.15 to 12.5."
43,Potential AI-Driven Algorithmic Collusion and Influential Factors in Construction Bidding,"Artificial intelligence (AI) is increasingly aiding human decision makers in construction bidding processes by analyzing competitors' bidding patterns. However, concerns are emerging about the potential for AI-driven algorithmic collusion, which might inflate prices and disrupt fair competition in various sectors. Given the unique dynamics of the construction sector and its growing reliance on AI, understanding the impact of these algorithms on the bidding landscape is essential, both academically and practically. Thus, this study investigates the impact of AI in the construction bidding market on bid pricing patterns to predict how the landscape of the market might change as AI starts to play a more prominent role. We subjected AI bidding agents to repeated competitions with each other in computer-simulated construction bidding marketplaces. We focused on the markup decisions made by the AI bidders. Our findings indicate that AI bidders tend to develop cooperative strategies over time, leading to higher bids overall compared to lower, competitive bids. This collusive behavior was facilitated by frequent interactions (previous bidding competitions over time) between AI bidders. This collusive behavior was enabled by algorithms that aimed to maximize the profit and was hindered by algorithms that aimed to maximize the number of project wins. These findings highlight potential fairness and competitiveness issues in construction bidding with dominant AI bidders.","Heo, C.; Park, M.; Ahn, C.R.",Heo et al. (2024),2024,Journal of Computing in Civil Engineering,https://doi.org/10.1061/JCCEE5.CPENG-5683,Republic of Korea,"Construction bidding, specifically markup decision strategies and bid pricing in competitive bidding processes",Risk management,Quantitative,"The paper employs computer simulation using reinforcement learning (Q-learning algorithm) to model AI bidding agents competing in repeated construction bidding competitions. The agents learn optimal markup strategies through trial and error, receiving rewards based on different bidding objectives. Experiments varied key factors including number of bidders (2-5), bidding objectives (maximize wins vs. maximize profit), and frequency of interaction, with 900 experiments conducted across different parameter settings.","The study aims to predict how the growing integration of AI into the construction bidding market might influence bidders' markup strategies and market trends, specifically investigating whether AI bidders develop collusive behavior and identifying factors that facilitate or hinder such algorithmic collusion.","The paper addresses the lack of research investigating how the introduction and integration of AI might impact the construction bidding market, particularly regarding potential algorithmic collusion. While previous studies focused on developing AI algorithms for bidding effectiveness, there was limited research on anticipating how the construction bidding market landscape might change due to ongoing competition among AI bidders.","Future research should incorporate bid/no-bid decision processes, modify reward functions to include penalties for unsuccessful bids, explore faster learning algorithms (e.g., DQN, actor-critic), and expand experiments to include multiple winner determination methods beyond lowest-bid criteria. Additionally, research should investigate whether pre-trained agents and offline training can reduce the number of iterations needed for collusion, and examine how knowledge transfers across different bidding algorithms and market conditions.","AI bidders following profit-maximization objectives exhibited collusive behavior by maintaining inflated bid prices (MUCR of 1.198) significantly higher than human bidders (MUCR of 0.943) and competitive AI bidders (MUCR of 1.05). Collusive behavior was facilitated by frequent interactions between AI bidders and profit-maximization algorithms, while it was hindered by increased number of competitors and win-maximization algorithms. The collusive pricing pattern persisted across 900 different parameter configurations, demonstrating robustness of the findings.",Q-learning algorithm (reinforcement learning),"Historical bidding data from Washington State Department of Transportation (WSDOT) comprising 1,244 public construction projects valued between 1-5 million USD, including project descriptions, submitted bids, winning bids, and contractor names. The data was preprocessed using the Interquartile Range (IQR) method to remove outliers, resulting in MUCR values ranging from 0.7 to 1.2."
