ID,Title,Abstract,Authors,Author_Year,Year,Journal,DOI,Research Location,Construction Application Area,Construction Topic,Research Method,Methodology,Research Goal,Gaps Addressed,Future Research,Results,AI Model Used,Data Types
1,Artificial intelligence for BIM content management and delivery: Case study of association rule mining for construction detailing,"The proliferation of Building Information Modeling (BIM) applications, in tandem with the extensive variation of building products, pose new demands on design and engineering firms to efficiently manage and reuse BIM content (i.e., data-rich parametric model objects and assembly details). Tasks such as classifying BIM objects, indexing them with meta-data (e.g., category), and searching digital libraries to load objects into models still plague practice with inefficient manual workflows. This research aims to improve the productivity of BIM content management and retrieval by developing an AI-backed BIM content recommender system. Using data from a case-study firm, this research extracted content from over 30,000 technical BIM views (e.g., plans, sections, details) in historical projects to build an unsupervised machine-learning prototype with association rule mining. This prototype explicated the strength of relationships among co-occurring BIM objects. Using this prototype as the backbone AI-engine in live BIM sessions, this research developed a context-aware recommender system that dynamically provides BIM users with a set of objects associable with their modeling context (e.g., type of view, existing objects in the model) and human–computer interactions (e.g., objects selected by the user). By mining association data from hundreds of historical projects, this development marks a departure from the existing prototypes that rely on explicit coding, recurring user input, or subjective ratings to recommend BIM content to users. The simulation and experimental implementation of this recommender system yielded high efficacy in predicting content needs and achieved significant savings in the time spent on conventional BIM workflows.","Abdirad, H.; Mathur, P.",Abdirad and Mathur (2021),2021,Advanced Engineering Informatics,https://doi.org/10.1016/j.aei.2021.101414,United States,"BIM content management and delivery, construction detailing, object recommendation systems","Construction technologies (BIM, drones, laser scanning, robotics, digital twins, sensor networks)",Mixed method,"The paper uses Association Rule Mining (ARM) as an unsupervised machine learning approach to mine BIM object data from over 30,000 technical views in historical projects. The methodology includes data collection from 400+ projects, data cleaning and transformation, model development using FP-Growth algorithm, simulation-based evaluation on test data, and experimental implementation with BIM users to measure time savings.","The research aims to develop an AI-backed BIM Content Recommender System (BCRS) that automatically predicts and recommends BIM objects to users based on modeling context and historical associations, thereby minimizing manual search and retrieval inefficiencies in BIM workflows.","The paper addresses gaps in existing BCMD solutions that rely on manual queries, explicit coding, extensive user input, subjective ratings, or heterogeneous non-BIM data. It also addresses the lack of context-aware systems that learn from exogenous relationships and logical associations between different BIM objects in construction assemblies.","The paper suggests that future research should address limitations related to generalizability across different firms and disciplines, account for new BIM objects or assemblies not present in historical data, and explore recurring maintenance tasks to keep the system updated with evolving BIM standards and practices.",The simulation achieved over 80% efficacy in predicting required BIM objects for creating views. The experimental implementation with five BIM users showed statistically significant time savings of 15% (mean difference = 2.1 min; t(49) = 7.66; p < 0.001) when using the BCRS compared to conventional workflows.,Association Rule Mining (ARM) using FP-Growth algorithm with Kulczynski measure for evaluating association strength,"BIM content usage data from over 30,000 technical views (plans, sections, details) across 400+ projects, including BIM object instances, view types, and transaction sets of co-occurring objects. The data was extracted from Autodesk Revit models (versions 2014-2021) and stored in JSON format for analysis."
2,Generative BIM workspace for AEC conceptual design automation: prototype development,"Purpose: The integration and automation of the whole design and implementation process have become a pivotal factor in construction projects. Problems of process integration, particularly at the conceptual design stage, often manifest through a number of significant areas, from design representation, cognition and translation to process fragmentation and loss of design integrity. Whilst building information modelling (BIM) applications can be used to support design automation, particularly through the modelling, amendment and management stages, they do not explicitly provide whole design integration. This is a significant challenge. However, advances in generative design now offer significant potential for enhancing the design experience to mitigate this challenge. Design/methodology/approach: The approach outlined in this paper specifically addresses BIM deficiencies at the conceptual design stage, where the core drivers and indicators of BIM and generative design are identified and mapped into a generative BIM (G-BIM) framework and subsequently embedded into a G-BIM prototype. This actively engages generative design methods into a single dynamic BIM environment to support the early conceptual design process. The developed prototype followed the CIFE ""horseshoe"" methodology of aligning theoretical research with scientific methods to procure architecture, construction and engineering (AEC)-based solutions. This G-BIM prototype was also tested and validated through a focus group workshop engaging five AEC domain experts. Findings: The G-BIM prototype presents a valuable set of rubrics to support the conceptual design stage using generative design. It benefits from the advanced features of BIM tools in relation to illustration and collaboration (coupled with BIM's parametric change management features). Research limitations/implications: This prototype has been evaluated through multiple projects and scenarios. However, additional test data is needed to further improve system veracity using conventional and non-standard real-life design settings (and contexts). This will be reported in later works. Originality/value: Originality and value rest with addressing the shortcomings of previous research on automation during the design process. It also addresses novel computational issues relating to the implementation of generative design systems, where, for example, instead of engaging static and formal description of the domain concepts, G-BIM actively enhances the applicability of BIM during the early design stages to generate optimised (and more purposeful) design solutions.","Abrishami, S.; Goulding, J.; Rahimian, F.",Abrishami et al. (2021),2021,"Engineering, Construction and Architectural Management",https://doi.org/10.1108/ECAM-04-2020-0256,United Kingdom,"Conceptual design automation, Building Information Modelling (BIM), design optimization, space planning","Construction technologies (BIM, generative design / design automation)",Mixed method,"The research followed the CIFE 'horseshoe' methodology aligning theoretical research with scientific methods. It involved software development process prototyping with seven sequential stages, developing a Generative BIM (G-BIM) prototype that integrates genetic algorithms with BIM. The prototype was validated through a focus group with five AEC professionals conducting comparative design sessions using conventional methods versus the G-BIM tool.",The research aims to leverage conceptual design automation within AEC projects using BIM-integrated generative design through developing a proof of concept Generative BIM Workspace that enhances designers' abilities to procure evolving novel solutions and assist them throughout the design process with change management and model modification capabilities.,Existing design automation and decision-making support tools mainly focus on form finding/planning and are incapable of engaging in information generation during early design stages. Previous generative tools fail to embed information into generated alternative designs and do not meet basic principles of information modelling and data management requirements.,"Due to expansion beyond time limits, the final prototype has not yet been fully examined in a range of real-life design settings. Future work aims to improve G-BIM through user participation and reflection on the design process, with propositions for further enhancement in each context of use to adjust to variable contexts and different AEC disciplines.","The G-BIM prototype successfully demonstrated the ability to capture project design information and create optimal design solutions. Participants in the focus group showed higher degrees of innovation, creativity, and productivity in developing alternative strategies and designs when using G-BIM compared to conventional methods, demonstrating improved abstract thinking and producing generalizable information content.","Genetic Algorithm (GA) with components including elitism, tournament/roulette wheel selection, one-point and two-point crossover, and mutation operations","Design brief specifications including number of spaces, site boundary, number of floors, space dimensions, building parameters, and constraints. The data includes both user inputs (design requirements) and generated alternatives with associated fitness values, which are stored and can be exported/imported for reuse."
3,A novel feature engineering-based hybrid approach for precise construction cost estimation using fuzzy-AHP and artificial neural networks,"The integration of Artificial Intelligence (AI) into construction cost estimation is transforming the way engineers tackle complex challenges. AI algorithms play a pivotal role in predicting project costs by scrutinizing historical data from previous construction projects. This study introduces a novel hybrid approach combining the Fuzzy-Analytic Hierarchy Process (F-AHP) and Artificial Neural Networks (ANNs) to enhance the accuracy of construction cost estimations. The F-AHP identifies the most influential features affecting project costs and assigns appropriate weights, while the ANN captures the intricate and 'unknown' mathematical relationships between these features and the corresponding costs. The approach was validated using real-world data from 96 residential and specialized housing projects in Amman, Jordan spanning from 2014 to 2021. Eleven key features are selected to train the ANN prediction model. To enhance prediction accuracy, the ANN model is optimized in terms of training/learning algorithms, hidden-neuron activation functions and the number of hidden neurons. The Qusai Newton, an exponential linear unit (Elu) function and 8 neurons were identified, respectively, as the optimal configuration, based on standard accuracy metrics. This optimized setup yields a Root Mean Square Error of 31,000 JD, a Mean Absolute Percentage Error of 3% and a maximum Coefficient of Determination of 98%.","Abu-Mahfouz, E.; Al-Dahidi, S.; Gharaibeh, E.; Alahmer, A.",Abu-Mahfouz et al. (2025),2025,International Journal of Construction Management,https://doi.org/10.1080/15623599.2025.2482207,"Jordan, USA",Construction cost estimation,Cost estimating,Quantitative,"The study proposes a hybrid approach combining Fuzzy-Analytic Hierarchy Process (F-AHP) and Artificial Neural Networks (ANNs). F-AHP is used to identify and weight the most influential features affecting construction costs, while ANN captures complex nonlinear relationships between features and costs. The methodology involves feature engineering through clustering (F0, F1, FAHP), feature selection using F-AHP weights, and cost prediction using optimized ANN models with various training algorithms and activation functions.",To develop and validate a hybrid framework that integrates F-AHP with ANNs for more accurate construction cost estimations in residential and specialized housing projects. The study aims to improve prediction accuracy by identifying influential features and optimizing the ANN model configuration.,"The paper addresses the lack of hybrid approaches combining F-AHP and ANN techniques for construction cost estimation. It also addresses the need for engineers to have expertise in integrating AI-based cost estimation tools into their design processes, which is currently lacking in the construction industry.","Future research directions include expanding the dataset to include diverse construction projects from different regions, investigating other machine learning techniques that can be integrated with F-AHP (such as decision trees or ensemble methods), and exploring the impact of additional features like socio-economic factors or environmental variables on construction cost estimation.","The optimized ANN model using Quasi-Newton training algorithm, Exponential Linear Unit (ELU) activation function, and 8-9 hidden neurons achieved impressive results with a Root Mean Square Error of 31,000 JD, a Mean Absolute Percentage Error of 3%, and a Coefficient of Determination (R²) of 98%. The model demonstrated close alignment between estimated and actual costs across the 96 construction projects studied.",Artificial Neural Networks (ANNs) with Fuzzy-Analytic Hierarchy Process (F-AHP),"The dataset consists of real-world construction data from 96 residential and specialized housing projects in Amman, Jordan, spanning from 2014 to 2021. After preprocessing, 115 projects with 42 features were used, including variables such as materials costs (bricks, steel, concrete), excavation costs, finishing types, building area, number of floors, location, and total project costs measured in Jordanian Dinars (JD)."
4,Decentralizing construction AI applications using blockchain technology,"Decentralizing the Artificial Intelligence (AI) applications is deemed the next wave of Blockchain Technology (BT) in the construction industry. Most of previous research studies employed the AI and the BT separately with limited efforts providing a conceptual view for possible convergence in real-life applications. Nevertheless, such efforts do not address construction applications. This research introduces a novel tailorable decentralized AI system that utilizes BT as a computing-oriented technology. The proposed system is developed as an inference engine while having a number of interesting features. First, the system validates and audits the decision-making process while sharing and recording the input data and the computed outcomes in a synchronized trusted manner. Second, the system allows the formation of distributed AI repository that can absorb and manage concurrent use-cases while targeting different scopes and covering diverse AI branches. Third, it provides a workable solution for the AI applications' distribution problem, which hinders their wide employment. Fourth, the introduced system guarantees sustainable versioning and evolution over time for AI applications based on their performance or the newly acquired data. A case study of estimating the construction cost for road projects is provided to illustrate the system's workability and demonstrate its performance.","Adel, K.; ElHakeem, A.; Marzouk, M.",Adel et al. (2022),2022,Expert Systems with Applications,https://doi.org/10.1016/j.eswa.2022.116548,Egypt,Construction cost estimation for road projects,"Construction technologies (BIM, drones, laser scanning, robotics, digital twins, sensor networks)",Mixed method,"The paper develops a decentralized AI system using blockchain technology (Hyperledger Fabric) integrated with a machine learning model (artificial neural network). The system consists of three layers: intelligent chaincode layer (holds ML models), permissioned blockchain network layer (manages actors and validation), and frontend access layer (CLI-based interface). The ML model was trained using historical road project data and embedded in smart contracts/chaincodes for on-chain inference.","To introduce a novel tailorable decentralized AI system that utilizes blockchain technology as a computing-oriented platform to validate and audit AI decision-making processes, enable distributed AI repository formation, solve AI applications' distribution problems, and guarantee sustainable versioning and evolution of AI models over time.","The paper addresses three major gaps: (1) lack of provenance and authenticity of data sources in centralized AI systems leading to biased outcomes, (2) centralized data ownership exposing data to security risks and tampering, and (3) absence of secure sharing platforms causing repetitive efforts in developing same-purpose AI models.","Future research can extend the system to provide a completely decentralized AI platform using blockchain and Inter-Planetary File System to collect, refine, and learn from chained data to produce on-chain trained AI models. This would enable decentralized learning processes, support image processing models and visuals' storage, and avoid repetitive records using content hashing mechanisms.","The system successfully demonstrated acceptable computational speed with writing latency ≤3000ms and reading latency ≤500ms. The embedded ML model achieved cost estimation accuracy within parametric cost estimate limits with MAEP of 6.64%, 5.79%, and 9.73% for training, cross-validation, and validation sets respectively. The system proved scalable for adding new participants and capable of detecting incomplete data submissions.",Artificial Neural Network (Multi-buffer Perceptron) with Levenberg Marquardt algorithm for supervised learning and hyperbolic-tangent activation function,"Historical construction project data from the General Authority for Roads, Bridges, and Land Transport in Egypt, including seven parameters: type of work, grade of road, construction duration, construction year, sector, road length, and road width. The dataset was divided into training (60 projects), cross-validation (5 projects), and validation (10 projects) sets."
5,The attribute impact concept: Applications in case-based reasoning and parametric cost estimation,"The success of every construction project depends on the satisfactory achievement of a client's needs relating to cost, duration, and quality. Among them, costs must be managed with special awareness. In an effort to improve the estimate accuracy of cost during the initial stages of a building project, this research introduces the concept of 'attribute impact' (AI), which can measure the weights of attributes quantitatively and prioritize them. This study will also explain AI development, which adopts the impulse-momentum theorem of physics. For a case study, the project analyzes 163 public apartment buildings from 15 housing complex projects in Korea. To examine the validity of the proposed AI, the case study carries out two types of validation in terms of estimate accuracy using the parametric method and the case-based reasoning (CBR) applicability test. The validation results support the acceptable use of the suggested AI in measuring the weights of attributes and its estimate accuracy when combined with parametric or CBR estimation.","Ahn, J.; Ji, S.-H.; Park, M.; Lee, H.-S.; Kim, S.; Suh, S.-W.",Ahn et al. (2014),2014,Automation in Construction,https://doi.org/10.1016/j.autcon.2014.03.011,Republic of Korea (South Korea),"Cost estimation for building projects, specifically parametric cost estimation and case-based reasoning (CBR) for early-stage construction cost prediction",Cost estimating,Mixed method (quantitative analysis with case study validation),"The paper develops the Attribute Impact (AI) concept based on the impulse-momentum theorem from physics, where AI equals attribute weight multiplied by attribute range. The methodology involves: (1) collecting cost data from 163 public apartment buildings in Korea, (2) selecting 11 influential attributes, (3) calculating attribute weights using correlation coefficients, (4) computing attribute ranges from the database, (5) deriving AI values, and (6) conducting two validations - one using parametric estimation with multiple regression analysis and another testing CBR applicability by comparing AI with other weighting methods (regression coefficient, feature counting, genetic algorithm).","To introduce and validate the concept of 'attribute impact' (AI) that can quantitatively measure the weights of attributes and prioritize them for improved cost estimation accuracy during the initial stages of building projects, considering both the relationships between attributes and costs as well as the range of various quality buildings in the database.","Existing attribute weight calculation methods (AHP, GA, PCA, FC, CA) do not consider the possible range of each attribute in historical databases. Since parametric and CBR-based cost estimation models depend on historical databases, attribute weights should be derived considering not only relationships between attributes and costs but also the database's diversity level and range of various quality buildings.",Future research should validate AI logic for generalization with other building types beyond public apartments. A method to automatically update attribute weights when additional data are added to cost databases is needed. Sensitivity analysis regarding how many attributes should be used and accuracy comparisons using various methods (CBR with neural networks) should be examined. The AI concept itself requires further examination and development.,"Validation-I showed that using AI resulted in lower average absolute error ratios (AER) for parametric estimation (2.75%-3.29%) compared to correlation coefficients (3.22%-4.04%) and traditional unit cost method (4.04%). Validation-II demonstrated that CBR cost estimation using AI weights achieved overall lower AER (4.01% for 1-NN, 4.34% for 10-NN) and better stability compared to other weighting methods like regression coefficient, feature counting, and genetic algorithm.","Case-Based Reasoning (CBR), Multiple Regression Analysis, Genetic Algorithm (used for comparison), Correlation Analysis, Feature Counting (used for comparison)","The study uses historical cost data from priced bills of quantities of 163 public apartment buildings from 15 housing complex projects in Korea (2005-2008), including 11 attributes such as number of households, gross floor area, number of floors, height between stories, and other building characteristics. The data were normalized for escalation using Korean construction cost indices."
