ID,Title,Abstract,Authors,Author_Year,Year,Journal,DOI,Research Location,Construction Application Area,Construction Topic,Research Method,Methodology,Research Goal,Gaps Addressed,Future Research,Results,AI Model Used,Data Types
76,Data-driven lifting-centered construction site layout planning decision approach with BIM,"Construction site layout planning (CSLP) is essential for optimizing the placement of temporary facilities (TFs), yet it inadequately integrates tower crane characteristics, causing inefficient material transportation and safety risk. Current decision-making relies on labor-intensive data extraction, complex mathematical models, and fragmented workflows incompatible with specialized software. This paper proposes an automated data-driven lifting-centered CSLP decision approach with building information modeling (BIM) and AI to enhance TF placement efficiency. The approach incorporates three stages: automated data extraction from the BIM model with users' promotion, development of data-driven lifting-based multi-objectives CSLP decision engines, and evaluation of generated TFs placement through BIM-based simulations. Validation indicates that over 92 % of AI-generated CSLP outcomes outperform traditional methods (genetic algorithm (GA)). Experiments on a real-world project demonstrate that this approach reduces processing time to 7.93 % of GA and lowers functional costs by 11.60 %. This method assists designers in expediting the CSLP decision-making process with BIM models.","Li, R.; Chi, H.-L.; Hu, Z.; Li, D.; Yi, W.; Brilakis, I.",Li et al. (2025),2025,Automation in Construction,https://doi.org/10.1016/j.autcon.2025.106467,"Hong Kong, United Kingdom, Japan","Construction site layout planning (CSLP), temporary facility placement, tower crane layout planning","Construction technologies (BIM, drones, laser scanning, robotics, digital twins, sensor networks)",Mixed method,"The paper proposes a data-driven approach integrating BIM with generative adversarial networks (GANs) for automated construction site layout planning. It involves three stages: (1) automated data extraction from BIM models using Revit API and OpenCV to generate 2D conditional images, (2) development of CSLP-GAN using conditional GANs to predict optimal temporary facility locations based on multi-objective optimization considering construction cost, safety, and lifting efficiency, and (3) visualization and integration of generated layouts back into BIM models. A mathematical optimization model generates paired datasets for training, and the approach is validated against traditional methods (Branch and Bound Algorithm and Genetic Algorithm) using processing time and functional cost metrics.","The paper aims to develop an automated, data-driven approach for lifting-centered construction site layout planning integrated with BIM that efficiently generates reasonable temporary facility locations in real-time while considering tower crane characteristics, construction cost, safety, and lifting efficiency.","The paper addresses the inadequate integration of tower crane characteristics in CSLP, labor-intensive manual data extraction processes, computational complexity of traditional mathematical optimization methods in large-scale projects, and fragmented workflows incompatible with specialized software that create information silos between abstract numerical results and actual construction data.","Future research should explore wider varieties of temporary facilities and their constraints, conduct comprehensive field validation studies to evaluate practical usability in real-world applications, integrate construction schedules and task dependencies to account for changing site layout requirements throughout the project lifecycle, and expand the system to accommodate different construction project types and dynamic changes in CSLP.","The AI method achieved 99.04% reduction in computational time compared to BBA and 84.15% reduction compared to GA, with over 92% of AI-generated layouts outperforming GA results. In a real-world case study in Wuhan, the approach reduced processing time to 7.93% of GA and lowered functional costs by 11.60%, demonstrating effectiveness in generating practical layouts that consider spatial relationships, safety distances, and operational efficiency.","Conditional Generative Adversarial Network (CGAN), specifically a U-Net architecture generator with ResNet blocks and a multi-scale discriminator","The dataset consists of 1,616 samples (1,294 training, 161 validation, 161 testing) of paired 1024×1024 pixel images representing construction site layouts extracted from BIM models and 2D CAD drawings of various high-rise building projects. Input images include construction boundaries, building boundaries, roads, entrances, tower cranes, and potential temporary facility locations; output images show optimal temporary facility placements calculated using mathematical optimization models considering transportation cost, construction safety, and lifting efficiency."
77,Generative design for modular construction structures based on expert knowledge-informed graph neural networks and meta-heuristics,"With the growing demands in the construction industry, coupled with cost pressures and environmental concerns, modular building (MB) solutions are proposed to address the challenges. However, the design process of MB is more fragmented and complex, especially the structural design. This requires a reconsideration of the automated approach for its layout design, incorporating structural design. This paper develops a generative AI-enabled framework, focusing on the structural design of reinforced concrete MB. The proposed hybrid approach integrates a graph neural network-based model in a genetic generative design framework to surrogate structure design. And multiple structural related objectives are optimized in this framework. It was tested in a real project in Hong Kong and compared with the engineer's design. The optimal Pareto-balanced compromise solution resulted in a 12 % increase in usable floor area, a 7 % increase in structural performance, and a 23 % reduction in construction cost.","Li, X.; Lu, W.; Peng, Z.",Li et al. (2025),2025,Automation in Construction,https://doi.org/10.1016/j.autcon.2025.106463,Hong Kong,"Structural design and layout optimization for modular buildings, specifically reinforced concrete modular buildings (RC-MB)",Prefabrication / modularization,Mixed method,"The paper develops a hybrid framework (MoSDA) that integrates a Graph Neural Network (GNN)-based structural expert AI (MsE-AI) with a genetic generative design (GGD) framework. The MsE-AI uses GATConv and SAGEConv layers to predict structural wall designs from flat layouts. The GGD framework includes a rule-based generator, the MsE-AI surrogate model, a multi-objective evaluator (UFA utilization, structural performance, construction cost), and NSGA-II optimization algorithm.","To develop an AI-enabled generative design framework (MoSDA) that assists architects in automated structural design and optimization of reinforced concrete modular building flat layouts during the preliminary design stage, considering structural performance, usable floor area, and construction cost simultaneously.","The paper addresses the lack of automated structural design tools for modular buildings, particularly RC-MB, and the difficulty of integrating structural engineering expertise into traditional rule-based generative design frameworks. It also addresses the challenge of optimizing multiple conflicting objectives (structural performance, usable floor area, cost) in early-stage modular building design.","Future research should consider the role of walls in establishing center of rigidity and controlling structural rotation under lateral forces, incorporate overall building structure design including cast-in-situ core design and load transfer between modules and building core, and expand the framework to incorporate other design factors such as energy efficiency and daylighting.","The MsE-AI model achieved 0.85 accuracy in predicting structural walls for RC-MB using the Flat-Con-WPID-Sw-UP representation method. When applied to a real Hong Kong project, the optimal Pareto-balanced solution achieved 12% improvement in usable floor area, 7% increase in structural performance, and 23% reduction in construction cost compared to the engineer's design.",Graph Neural Network (GNN) combining Graph Attention Network (GATConv) and GraphSAGE (SAGEConv) layers,"The study used 98 real RC-MB flat layout data from Hong Kong Housing Development's open data, which were augmented 48-fold through flipping, rotating, and translating operations, resulting in 4,704 graphs. The data includes flat layouts with structural wall information, module configurations, and building element features represented as graph structural data."
78,Heterogeneous structural mechanics mechanism in underground excavation for Intelligence construction based on hybrid physical-guided and data-driven method,"The structural mechanics mechanism research in underground excavation is a prominent challenge for the time varying scenarios, the uncertainty of the complex system and the environment. In this study, to explore the structural mechanics mechanism, virtual models are performed based on the physical data of the soil and structure, and are compared to the on-site photos of the same scenarios. The basic mechanics is inspected by three Generative AI models in 73 tests to explore the mechanisms by text outputs. The physical-based simplified mechanics models are calculated on the first two supports scenarios to offer some guides and knowledge to the following data mining work. The structural physical mechanics is also numerical simulated to offer some further physical guides. The structure monitoring data of the support axial force and the diaphragm wall deformation in the deep excavation is explored with the time and excavating depths varying, and the relationship of the dual heterogeneous mechanics performance are qualitative discussed by a three-dimension demonstration method. Furthermore, a novel index, the ratio of the force to the deformation, is proposed on the data-driven sight. The relationship is calculated quantitatively on the proposed index in different construction stages, and the probability distribution is inspected. In summary, three physical-based models are performed and investigated to offer physical guides for data-driven dual heterogeneous mechanics mechanism on an underground excavation case in Metro construction, and the qualitative and quantitative exploring are performed based on the three-dimension data demonstrations and on a proposed index. The mechanism exploring methods can be synthetical integrated for the future engineering expert systems in engineering, and for the coming intelligence construction.","Li, W.-M.; Dou, Y.-C.; Han, X.-R.; Yang, W.-J.; Lian, J.",Li et al. (2025),2025,Expert Systems with Applications,https://doi.org/10.1016/j.eswa.2025.127750,China,"Underground excavation structural mechanics, deformation monitoring, support structure analysis, and construction safety in Metro construction",Structural engineering,Mixed method,"The paper employs a hybrid physical-guided and data-driven approach. Physical-based models include simplified mechanics models (calculated using Force Method and Moment Distribution Method), numerical finite element models, and virtual BIM models compared with on-site photos. Data-driven analysis explores monitoring data of support axial force and diaphragm wall deformation across different construction stages. The study also preliminarily tests three Generative AI models (ERNIE Bot, Baidu AI, and Doubao) with 73 tests on 8 structural mechanics scenarios to explore their potential for mechanism explanation.","The paper aims to explore the heterogeneous structural mechanics mechanism in underground excavation by integrating physical-guided models (simplified mechanics, numerical simulation, and virtual models) with data-driven analysis of monitoring data, and to investigate the relationship between support axial force and diaphragm wall deformation for intelligence construction applications.","The paper addresses the challenge that structural mechanics mechanisms in underground excavation are difficult to describe by single research methods due to time-varying scenarios, system complexity, and environmental uncertainty. It also addresses the limitation that data-driven approaches in civil engineering are constrained by data loss, noise, and errors, requiring integration of multiple methods for comprehensive understanding.","Future work includes improving monitoring project design, enhancing calculation and simulation accuracy, further integration with AI science and technology progress, developing more efficient classification methods for construction stages, and advancing the integration of multiple methods to achieve better accuracy and efficiency for intelligent construction expert systems.","The study found that support axial force and diaphragm wall deformation show qualitative associations across four construction stages, with force increasing rapidly before the 5th support installation and during bottom slab concreting. A novel quantitative index (ratio of force to deformation) was proposed, showing similar distribution patterns across different supports in corresponding stages, indicating potential for engineering decision support. The ratio distributions were primarily in intervals of [200,800) for early stages and [100,400) for later stages.","Generative AI models: ERNIE Bot, Baidu AI (文心一言), and Doubao (豆包). Also tested DeepSeek AI for quantitative calculations.","The paper uses multiple data types including: (1) structural monitoring data (support axial force and diaphragm wall deformation measured by sensors), (2) geotechnical exploration data (soil layer properties), (3) construction design data (support dimensions, depths, and schedules), (4) on-site construction photos, (5) virtual BIM model data created in Revit, and (6) numerical simulation data from finite element analysis across 24 construction scenarios over 205 days."
79,Impacts of Collaborative Robots on Construction Work Performance and Worker Perception: Experimental Analysis of Human-Robot Collaborative Wood Assembly,"Collaborative robots are increasingly recognized as potential assistants to relieve workers from repetitive and physically demanding tasks on construction jobsites. Despite the great potential, most efforts have focused on developing various artificial intelligence (AI) and robotic technologies to achieve specific human-robot collaboration (HRC) functions. However, there is a significant lack of research regarding the impacts of such collaboration on construction work performance and workers' perception and acceptance of collaborative robots, which could be a critical influence factor on the feasibility and effectiveness of HRC on construction jobsites. To this end, this study aims to evaluate the multidimensional impacts of collaborative robots on work efficiency, quality, and workload as well as workers' perception and acceptance. HRC experiments on sample construction tasks (i.e., wood assembly) were conducted in conjunction with quantitative measurements and subject surveys. Through comparison between HRC experiments and human-human collaboration (HHC) experiments based on this case study, it was found that HRC could improve up to 29.3% and 88.6% in work efficiency and assembly accuracy, respectively, and reduce workers' workload by up to 20.3%. Furthermore, workers' perception of HRC is found to be positive overall with higher acceptance after HRC experience, characterized by questionnaires designed based on the technology acceptance model. Through physical experiments, this research is expected to produce more reliable results compared with conventional approaches where participants are simply provided with imaginary scenarios. The findings will also guide the development of robotic technologies to enhance the practical application of HRC in construction.","Liang, X.; Rasheed, U.; Cai, J.; Wibranek, B.; Awolusi, I.",Liang et al. (2024),2024,Journal of Construction Engineering and Management,https://doi.org/10.1061/JCEMD4.COENG-14390,United States,"Human-robot collaboration in construction assembly tasks, specifically wood assembly and construction work performance evaluation",Construction automation,Mixed method,"The study conducted physical experiments with human-robot collaboration (HRC) and human-human collaboration (HHC) on wood assembly tasks at two difficulty levels. A total of 13 participants formed 9 groups performing both HRC and HHC experiments. Work performance was measured through completion time, accuracy, nailing quality, and workload (heart rate reserve). Worker perception was assessed using TAM-based surveys distributed before and after HRC experiments, combined with post-experiment interviews.","To evaluate the multidimensional impacts of collaborative robots on construction work performance (efficiency, quality, workload) and workers' perception and acceptance of collaborative robots through experimental analysis of human-robot collaborative wood assembly tasks.","Most research has focused on developing AI and robotic technologies for specific HRC functions, but there is significant lack of research on the actual impacts of HRC on construction work performance and workers' perception. Previous studies used imaginary or simulated scenarios rather than physical experiments, which could be biased and not reflect reality.",Future research should focus on large-scale structures to include broader real-world construction scenarios and enhance the intelligence of collaborative robots to enable autonomous physical interactions and proactive action planning. Studies should also include more experienced workers across different experience levels and trades to better understand how HRC impacts vary based on worker characteristics.,"HRC improved work efficiency by up to 29.3%, assembly accuracy by up to 88.6%, and reduced workers' workload by up to 20.3% compared to HHC. Workers showed overall positive perception of HRC with higher acceptance after experiencing actual collaboration, though they identified limitations including slow robot operating pace and lack of communication about robot intentions.",No Model - The robot was preprogrammed using PolyScope interface for predetermined trajectories and movements,"Quantitative data including completion time, assembly accuracy measurements, nailing quality counts, and heart rate data from wearable Fitbit devices. Qualitative data from TAM-based 7-point Likert scale surveys (pre and post-experiment) and open-ended post-experiment interviews with participants."
80,"Impact of Digital Technology Adoption on the Comparative Advantage of Architectural, Engineering, and Construction Firms in Singapore","With a plethora of digital technologies, and some having high capital and running costs, it is critical to know which of these give architectural, engineering, and construction (AEC) firms a comparative advantage. Comparative advantage is measured using these metrics: higher project quality (Y1), productivity (Y2), ability to win tenders (Y3), and reputation (Y4), compared to AEC firms' nearest competitors. This study investigated which specific digital technologies give rise to a comparative advantage for adopters in the AEC sector. The research design was an online survey using a structured questionnaire. Data were collected from AEC professionals in Singapore. The research found that the adoption of five digital technologies is significantly associated with higher project quality, productivity, and reputation compared to AEC firms' nearest competitors. These 'super technologies' are cloud-based technology, design for manufacturing and assembly (DfMA), Internet-of-Things (IoT), robotic technology, and artificial intelligence (AI). The study discovered some digital technologies that are not correlated with any comparative advantage metrics. The contribution to knowledge is the creation of the digital technology adoption model that potential adopters may use to help them decide which specific digital technologies to adopt to achieve comparative advantage. For firms that are already adopting digital technologies, the adoption model serves as a benchmarking tool to measure comparative advantage. The implication for practice is for potential adopters to zoom in on the 'super technologies' and eschew those that do not provide comparative advantages.","Ling, F.Y.Y.; Heng, G.T.H.; Chang-Richards, A.; Chen, X.; Yiu, T.W.",Ling et al. (2023),2023,Journal of Construction Engineering and Management,https://doi.org/10.1061/JCEMD4.COENG-13743,Singapore,"Digital technology adoption for comparative advantage in project quality, productivity, ability to win tenders, and reputation",Smart construction technologies,Quantitative,"The research used an online survey with a structured questionnaire distributed to 101 AEC professionals in Singapore. Statistical analyses including Wilcoxon signed ranks test, Mann-Whitney U test, Spearman's rank correlation, and multiple linear regression were conducted to examine the relationship between digital technology adoption levels and comparative advantage metrics.","To determine the impact of adopting specific digital technologies on AEC firms' comparative advantage measured by project quality, productivity, ability to win tenders, and reputation compared to their nearest competitors, and to develop a digital technology adoption model to guide firms.",Previous studies on digital technology benefits focused on only one or two technologies or measured benefits at a macro level without considering comparative advantage. This study fills the gap by identifying which specific digital technologies bring about comparative advantage to adopters across multiple performance metrics.,"Future case studies may be conducted by analyzing specific AEC firms in different countries to objectively measure the extent to which each digital technology has been adopted and their comparative advantage, investigating the reasons for digital technology adoption and other confounding variables of comparative advantage.","Five 'super technologies' (IoT, cloud-based technology, robotic technology, AI, and DfMA) were found to be significantly associated with higher project quality, productivity, and reputation. AI was identified as the 'supreme' technology, significantly correlated with all four comparative advantage metrics. The study created a digital technology adoption model showing which technologies provide comparative advantages.","No specific AI model was developed in this paper. The paper studies AI/machine learning/deep learning as one of the digital technologies being adopted by construction firms, but does not develop or implement an AI model itself.","Primary data collected through questionnaire survey using 5-point Likert scales. Data includes: respondents' interaction level with 16 digital technologies (9-point descriptive scale), and self-reported comparative advantage ratings on project quality, productivity, ability to win tenders, and reputation compared to nearest competitors."
